,nation,title,text,lemmas,phrased,language_family,sid
110,australian_ethnic,Piggiebillah the Porcupine,"Piggiebillah was getting old and not able to do much hunting for himself. Nor did he care so much for the flesh of emu and kangaroo as he did for the flesh of men.He used to entice young men to his camp by various devices, and then kill and eat them.At last the Daens found out what he was doing. They were very angry, and determined to punish him. “We will kill or cripple him,” they said, “so that he, giant though he be, shall be powerless against our people.” A mob of them went and surrounded his camp.He was lying asleep, face downwards, as he did not wish his doowee or dream spirit to leave him, as it might have done had he slept on his back, with his mouth exposed.In his sleep even he seemed to hear a rustling in the leaves, but suspected no evil, saying drowsily to himself: “It is but the Bullah Bullah, or butterflies, fluttering round.” Then he slept on while his enemies closed in round him.Raising their spears, with one accord they threw them at him, until his back was one mass of them sticking up all over it. Then the Daens rushed in, and broke his arms and legs, with their boondees and woggarahs, crippling him indeed. As he made neither sound nor movement, they thought they had killed him, and went back, satisfied with their vengeance, to the camp, meaning to return for their weapons later.As soon as the Daens were gone, Piggiebillah crawled away on all fours to the underground home of his friend, Murgah Muggui the spider. Down he went in through the trap-door, and there he stayed until his wounds were healed.He tried to draw out the spears, but was unable to do so; they stayed in his back for ever, and for ever he went on all fours, as his tribe have done ever since. They, too, as he did, get quickly underground if in danger from enemies.When the Guineeboo or redbreasts, of whose family Piggiebillah’s wife had been one, heard what had happened to him, they lifted up their voices and sang the death wail until its melancholy sounds echoed through the bush, as they rose and fell in wave-like cadences. In their grief they cut their heads with muggil or stone knives, and comeboos or tomahawks, until the blood ran down staining their breasts red, and the breasts of the Guineeboo have been red ever since.","['piggiebillah', 'able', 'much', 'hunt', 'care', 'much', 'flesh', 'kangaroo', 'flesh', 'entice', 'young', 'camp', 'various', 'device', 'kill', 'last', 'daens', 'found', 'angry', 'determine', 'punish', 'kill', 'cripple', 'giant', 'though', 'shall', 'powerless', 'people', 'surround', 'camp', 'asleep', 'face', 'downwards', 'wish', 'doowee', 'dream', 'spirit', 'leave', 'might', 'slept', 'back', 'mouth', 'expose', 'sleep', 'even', 'seem', 'hear', 'rustle', 'leaf', 'suspect', 'evil', 'drowsily', 'bullah', 'bullah', 'butterfly', 'flutter', 'round', 'slept', 'enemy', 'close', 'round', 'raise', 'spear', 'accord', 'threw', 'back', 'mass', 'stick', 'daens', 'rush', 'broke', 'boondees', 'woggarahs', 'cripple', 'indeed', 'make', 'neither', 'sound', 'movement', 'thought', 'kill', 'back', 'satisfied', 'vengeance', 'camp', 'meaning', 'return', 'weapon', 'later', 'soon', 'daens', 'piggiebillah', 'crawl', 'away', 'four', 'underground', 'home', 'friend', 'murgah', 'muggui', 'spider', 'trap-door', 'stayed', 'wound', 'heal', 'draw', 'spear', 'unable', 'stayed', 'back', 'ever', 'ever', 'four', 'tribe', 'ever', 'since', 'quickly', 'underground', 'danger', 'enemy', 'guineeboo', 'redbreast', 'whose', 'family', 'piggiebillah', 'wife', 'heard', 'happen', 'lift', 'voice', 'sang', 'death', 'wail', 'melancholy', 'sound', 'echoed', 'bush', 'rise', 'fell', 'wave-like', 'cadence', 'grief', 'head', 'muggil', 'stone', 'knife', 'comeboos', 'tomahawk', 'blood', 'stain', 'breast', 'breast', 'guineeboo', 'ever', 'since']","['piggiebillah', 'able', 'much', 'hunt', 'care', 'much', 'flesh', 'kangaroo', 'flesh', 'entice', 'young', 'camp', 'various', 'device', 'kill', 'last', 'daens', 'found', 'angry', 'determine', 'punish', 'kill', 'cripple', 'giant', 'though', 'shall', 'powerless', 'people', 'surround', 'camp', 'asleep', 'face', 'downwards', 'wish', 'doowee', 'dream', 'spirit', 'leave', 'might', 'slept', 'back', 'mouth', 'expose', 'sleep', 'even', 'seem', 'hear', 'rustle', 'leaf', 'suspect_evil', 'drowsily', 'bullah', 'bullah', 'butterfly', 'flutter', 'round', 'slept', 'enemy', 'close', 'round', 'raise', 'spear', 'accord', 'threw', 'back', 'mass', 'stick', 'daens', 'rush', 'broke', 'boondees', 'woggarahs', 'cripple', 'indeed', 'make', 'neither', 'sound', 'movement', 'thought', 'kill', 'back', 'satisfied', 'vengeance', 'camp', 'meaning', 'return', 'weapon', 'later', 'soon', 'daens', 'piggiebillah', 'crawl', 'away', 'four', 'underground', 'home', 'friend', 'murgah', 'muggui', 'spider', 'trap-door', 'stayed', 'wound_heal', 'draw', 'spear', 'unable', 'stayed', 'back', 'ever', 'ever', 'four', 'tribe', 'ever_since', 'quickly', 'underground', 'danger', 'enemy', 'guineeboo', 'redbreast', 'whose', 'family', 'piggiebillah', 'wife', 'heard', 'happen', 'lift', 'voice', 'sang', 'death', 'wail', 'melancholy', 'sound', 'echoed', 'bush', 'rise', 'fell', 'wave-like', 'cadence', 'grief', 'head', 'muggil', 'stone', 'knife', 'comeboos', 'tomahawk', 'blood', 'stain', 'breast', 'breast', 'guineeboo', 'ever_since']",austronesian,sid110
314,australian_ethnic,"Deereeree the Wagtail, and the Rainbow","Deereeree was a widow and lived in a camp alone with her four little girls. One day Bibbee came and made a camp not far from hers. Deereeree was frightened of him, too frightened to go to sleep. All night she used to watch his camp, and if she heard a sound she would cry aloud: “Deerceree, wyah, wyah, Deereeree,” Sometimes she would be calling out nearly all night.In the morning, Bibbee would come over to her camp and ask her what was the matter that she had called out so in the night. She told him that she thought she heard some one walking about and was afraid, for she was alone with her four little girls.He told her she ought not to be afraid with all her children round her. But night after night she sat up crying: “Wyah, wyah, Deereeree, Deereeree.”At last Bibbee said! “If you are so frightened, marry me and live in my camp. I will take care of you.” But Deereeree said she did not want to marry. So night after night was to be heard her plaintive cry of “Wyah, wyah, Deereeree, Deereeree.” And again and again Bibbee pressed her to share his camp and marry him. But she always refused. The more she refused the more he wished to marry her. And he used to wonder how he could induce her to change her mind.At last he thought of a plan of surprising her into giving her consent. He set to work and made a beautiful and many coloured arch, which, when it was made, he called Euloowirree, and he placed it right across the sky, reaching from one side of the earth to the other. When the rainbow was firmly placed in the sky, and showing out in all its brilliancy, of many colours, as a roadway from the earth to the stars, Bibbee went into his camp to wait. When Deereeree looked up at the sky and saw the wonderful rainbow, she thought something dreadful must be going to happen. She was terribly frightened, and called aloud: “Wyah, wyah.” In her fear she gathered her children together, and fled with them to Bibbee’s camp for protection.Bibbee proudly told her that he had made the rainbow, just to show how strong he was and how safe she would be if she married him. But if she would not, she would see what terrible things he would make to come on the earth, not just a harmless and beautiful roadway across the heavens, but things that would burst from the earth and destroy it.So by working on her mixed feelings of fear of his prowess, and admiration of his skill, Bibbee gained his desire, and Deereeree married him. And when long afterwards they died, Deereeree was changed into the little willy wagtail who may be heard through the stillness of the summer nights, crying her plaintive wail of “Deereeree, wyah, wyah, Deereeree.”And Bibbee was changed into the woodpecker, or climbing tree bird, who is always running up trees as if he wanted to be building other ways to the than the famous roadway of his Euloowirree, the building of which had won him his wife.","['deereeree', 'widow', 'live', 'camp', 'alone', 'four', 'little', 'girl', 'bibbee', 'come', 'make', 'camp', 'deereeree', 'frighten', 'frighten', 'sleep', 'night', 'watch', 'camp', 'heard', 'sound', 'would', 'aloud', 'deerceree', 'wyah', 'wyah', 'deereeree', 'sometimes', 'would', 'call', 'nearly', 'night', 'morning', 'bibbee', 'would', 'come', 'camp', 'matter', 'call', 'night', 'told', 'thought', 'heard', 'walk', 'afraid', 'alone', 'four', 'little', 'girl', 'told', 'ought', 'afraid', 'child', 'round', 'night', 'night', 'wyah', 'wyah', 'deereeree', 'deereeree', 'last', 'bibbee', 'frighten', 'marry', 'live', 'camp', 'take', 'care', 'deereeree', 'want', 'marry', 'night', 'night', 'heard', 'plaintive', 'wyah', 'wyah', 'deereeree', 'deereeree', 'bibbee', 'press', 'share', 'camp', 'marry', 'always', 'refuse', 'refuse', 'wish', 'marry', 'wonder', 'could', 'induce', 'change', 'mind', 'last', 'thought', 'plan', 'surprising', 'give', 'consent', 'work', 'make', 'beautiful', 'many', 'colour', 'arch', 'make', 'call', 'euloowirree', 'place', 'right', 'across', 'reach', 'side', 'earth', 'rainbow', 'firmly', 'place', 'show', 'brilliancy', 'many', 'colour', 'roadway', 'earth', 'star', 'bibbee', 'camp', 'wait', 'deereeree', 'look', 'wonderful', 'rainbow', 'thought', 'something', 'dreadful', 'must', 'happen', 'terribly', 'frighten', 'call', 'aloud', 'wyah', 'wyah', 'fear', 'gather', 'child', 'together', 'flee', 'bibbee', 'camp', 'protection', 'bibbee', 'proudly', 'told', 'make', 'rainbow', 'show', 'strong', 'safe', 'would', 'married', 'would', 'would', 'terrible', 'thing', 'would', 'make', 'come', 'earth', 'harmless', 'beautiful', 'roadway', 'across', 'heaven', 'thing', 'would', 'burst', 'earth', 'destroy', 'work', 'mixed', 'feeling', 'fear', 'prowess', 'admiration', 'skill', 'bibbee', 'gain', 'desire', 'deereeree', 'married', 'long', 'afterwards', 'deereeree', 'change', 'little', 'willy', 'wagtail', 'heard', 'stillness', 'summer', 'night', 'plaintive', 'wail', 'deereeree', 'wyah', 'wyah', 'deereeree', 'bibbee', 'change', 'woodpecker', 'climb', 'tree', 'bird', 'always', 'tree', 'want', 'building', 'famous', 'roadway', 'euloowirree', 'building', 'wife']","['deereeree', 'widow', 'live', 'camp', 'alone', 'four', 'little', 'girl', 'bibbee', 'come', 'make', 'camp', 'deereeree', 'frighten', 'frighten', 'sleep', 'night', 'watch', 'camp', 'heard_sound', 'would', 'aloud', 'deerceree', 'wyah', 'wyah', 'deereeree', 'sometimes', 'would', 'call', 'nearly', 'night', 'morning', 'bibbee', 'would', 'come', 'camp', 'matter', 'call', 'night', 'told', 'thought', 'heard', 'walk', 'afraid', 'alone', 'four', 'little', 'girl', 'told', 'ought', 'afraid', 'child', 'round', 'night', 'night', 'wyah', 'wyah', 'deereeree', 'deereeree', 'last', 'bibbee', 'frighten', 'marry', 'live', 'camp', 'take_care', 'deereeree', 'want_marry', 'night', 'night', 'heard', 'plaintive', 'wyah', 'wyah', 'deereeree', 'deereeree', 'bibbee', 'press', 'share', 'camp', 'marry', 'always', 'refuse', 'refuse', 'wish_marry', 'wonder', 'could', 'induce', 'change_mind', 'last', 'thought', 'plan', 'surprising', 'give', 'consent', 'work', 'make', 'beautiful', 'many', 'colour', 'arch', 'make', 'call', 'euloowirree', 'place', 'right', 'across', 'reach', 'side', 'earth', 'rainbow', 'firmly', 'place', 'show', 'brilliancy', 'many', 'colour', 'roadway', 'earth', 'star', 'bibbee', 'camp', 'wait', 'deereeree', 'look', 'wonderful', 'rainbow', 'thought', 'something', 'dreadful', 'must', 'happen', 'terribly_frighten', 'call_aloud', 'wyah', 'wyah', 'fear', 'gather', 'child', 'together', 'flee', 'bibbee', 'camp', 'protection', 'bibbee', 'proudly', 'told', 'make', 'rainbow', 'show', 'strong', 'safe', 'would', 'married', 'would', 'would', 'terrible', 'thing', 'would', 'make', 'come', 'earth', 'harmless', 'beautiful', 'roadway', 'across', 'heaven', 'thing', 'would', 'burst', 'earth', 'destroy', 'work', 'mixed', 'feeling', 'fear', 'prowess', 'admiration', 'skill', 'bibbee', 'gain', 'desire', 'deereeree', 'married', 'long', 'afterwards', 'deereeree', 'change', 'little', 'willy', 'wagtail', 'heard', 'stillness', 'summer', 'night', 'plaintive', 'wail', 'deereeree', 'wyah', 'wyah', 'deereeree', 'bibbee', 'change', 'woodpecker', 'climb_tree', 'bird', 'always', 'tree', 'want', 'building', 'famous', 'roadway', 'euloowirree', 'building', 'wife']",austronesian,sid314
