,nation,title,text,lemmas,phrased,language_family,sid
772,new_zealand_native,Hoheria Blossom,"Do you know the Lovely Ladies of the Bush? They swing on the tips of the Hoheria tree, with their floating white gowns and tossing silvery ringlets, and are so light and graceful that they float on the wind as they swing. If you could only see the Lovely Ladies dancing! But very few have been lucky enough for that!They dance on the wind, holding to the tips of the Hoheria and their white gowns flutter and swirl, and their ringlets float and sway, and sometimes in the joy of the dance a Lovely Lady lets go of her branch and comes fluttering down to earth.Then she can dance no more, but lies very still. It is rather sad, because once she has let go she may not go back and dance on the tree for a whole long year, and it is looked on rather as a disgrace to be the first to fall.However, she has not to wait long for company. For one by one, the Lovely Ladies, wild with the joy of the mazy dance, the soft rush of the wind and the laughing and clapping of the little leaves, loose their hold, and drift to earth light as thistle-down, and that is the end of their dancing for that year. Where do they go to while the year goes by? I have never found out, but I think it most likely that they go to the place they came from.“The wind is shaking the Hoheria tree,Cling, Maidens, cling!”“I’ll dance with you if you’ll dance with me,Swing, Maidens, swing!”“So up with a windy rush we go,Floating, fluttering, to and fro,”“Sing for the joy of it, Maidens, Oh!Sing, Maidens, sing!”The Piccaninnies simply love to watch the Lovely Ladies dancing, and long to be able to dance in the same way. When they hear the song, their little brown toes go fidgeting among the moss and leaves, and their heads nod-nodding to the air.Once they found a Hoheria tree after all the Lovely Ladies had left it, and now, they thought, was their chance. They swarmed all over the tree, clutched the tips of the delicate branches, and began working themselves up and down like mad.It was great fun, but with their chubby little brown bodies, short legs, and shock heads, it did not look quite the same thing, and three Bush Babies riding that way on a good-natured kiwi, laughed so much (and even the kiwi, which is a grave bird, looked up and smiled) that the Piccaninnies, feeling rather foolish, dropped to the the ground and ran away and hid in the fern.","['know', 'lovely', 'lady', 'bush', 'swing', 'hoheria', 'tree', 'float', 'white', 'gown', 'toss', 'silvery', 'ringlet', 'light', 'graceful', 'float', 'wind', 'swing', 'could', 'lovely', 'lady', 'dance', 'lucky', 'enough', 'dance', 'wind', 'hold', 'hoheria', 'white', 'gown', 'flutter', 'swirl', 'ringlet', 'float', 'sway', 'sometimes', 'dance', 'lovely', 'lady', 'branch', 'come', 'flutter', 'earth', 'dance', 'still', 'rather', 'back', 'dance', 'tree', 'whole', 'long', 'year', 'look', 'rather', 'disgrace', 'first', 'fall', 'however', 'wait', 'long', 'company', 'lovely', 'lady', 'wild', 'mazy', 'dance', 'soft', 'rush', 'wind', 'laugh', 'clap', 'little', 'leaf', 'loose', 'hold', 'drift', 'earth', 'light', 'thistle-down', 'dance', 'year', 'year', 'never', 'found', 'think', 'likely', 'place', 'come', 'wind', 'shake', 'hoheria', 'tree', 'cling', 'maiden', 'cling', 'dance', 'dance', 'swing', 'maiden', 'swing', 'windy', 'rush', 'float', 'flutter', 'sing', 'maiden', 'sing', 'maiden', 'sing', 'piccaninny', 'simply', 'love', 'watch', 'lovely', 'lady', 'dance', 'long', 'able', 'dance', 'hear', 'song', 'little', 'brown', 'fidget', 'among', 'moss', 'leaf', 'head', 'nod-nodding', 'found', 'hoheria', 'tree', 'lovely', 'lady', 'left', 'thought', 'chance', 'swarm', 'tree', 'clutched', 'delicate', 'branch', 'begin', 'work', 'like', 'great', 'chubby', 'little', 'brown', 'body', 'short', 'shock', 'head', 'look', 'quite', 'thing', 'three', 'bush', 'baby', 'good-natured', 'kiwi', 'laugh', 'much', 'even', 'kiwi', 'grave', 'bird', 'look', 'smile', 'piccaninny', 'feel', 'rather', 'foolish', 'drop', 'ground', 'away', 'fern']","['know', 'lovely_lady', 'bush', 'swing', 'hoheria', 'tree', 'float', 'white', 'gown', 'toss', 'silvery', 'ringlet', 'light', 'graceful', 'float', 'wind', 'swing', 'could', 'lovely_lady', 'dance', 'lucky_enough', 'dance', 'wind', 'hold', 'hoheria', 'white', 'gown', 'flutter', 'swirl', 'ringlet', 'float', 'sway', 'sometimes', 'dance', 'lovely_lady', 'branch', 'come', 'flutter', 'earth', 'dance', 'still', 'rather', 'back', 'dance', 'tree', 'whole', 'long', 'year', 'look', 'rather', 'disgrace', 'first', 'fall', 'however', 'wait', 'long', 'company', 'lovely_lady', 'wild', 'mazy', 'dance', 'soft', 'rush', 'wind', 'laugh', 'clap', 'little', 'leaf', 'loose', 'hold', 'drift', 'earth', 'light', 'thistle-down', 'dance', 'year', 'year', 'never', 'found', 'think', 'likely', 'place', 'come', 'wind', 'shake', 'hoheria', 'tree', 'cling', 'maiden', 'cling', 'dance_dance', 'swing', 'maiden', 'swing', 'windy', 'rush', 'float', 'flutter', 'sing', 'maiden', 'sing', 'maiden', 'sing', 'piccaninny', 'simply', 'love', 'watch', 'lovely_lady', 'dance', 'long', 'able', 'dance', 'hear', 'song', 'little', 'brown', 'fidget', 'among', 'moss', 'leaf', 'head', 'nod-nodding', 'found', 'hoheria', 'tree', 'lovely_lady', 'left', 'thought', 'chance', 'swarm', 'tree', 'clutched', 'delicate', 'branch', 'begin', 'work', 'like', 'great', 'chubby', 'little', 'brown', 'body', 'short', 'shock', 'head', 'look', 'quite', 'thing', 'three', 'bush', 'baby', 'good-natured', 'kiwi', 'laugh', 'much', 'even', 'kiwi', 'grave', 'bird', 'look', 'smile', 'piccaninny', 'feel', 'rather', 'foolish', 'drop', 'ground', 'away', 'fern']",austronesian,sid772
795,new_zealand_native,Clematis,"Of course fashions change, and no one need be surprised to find that crimson kilts were soon “out,” while the Piccaninny girls were to be seen walking about in pretty little white, frilly petticoats made out of clematis blossoms, and sun hats of the same flowers.The hats were rather silly, because the Piccaninnies lived so deep in the Bush that the sun couldn’t hurt them, but then fashions are absurd. (Look at the ladies who wear fur coats in hot climates!)The boys made no change because their kind of fashion doesn’t change, except sometimes you take great pains to iron the crease out of them, and other times you iron it in most carefull-ee.For some reason the boys didn’t like the girls’ change of frocks. Of course, they said, the girls would never play with them now, but the girls said oh yes, they would. The boys said:“You’d be scared to play berry fights like we used to.”But the girls said, as brave as could be:“Would we?”And the boys answered:“Let’s see you then!”So they all ran off and collected puriri berries, big purply red ones, rather squashy. Then the boys all yelled in chorus:Ka mate! Ka mate! Ka ora! Ka ora!Tenei te tangata puhuru huruNa na nei i tiki mai—whaka whiti te ra! Upane! Upane! Upane!kaupani whiti te ra!which means something very warlike, and the girls answered shrilly:Ka whawhai tonu! Ake! Ake! Ake!They said that because they had heard that someone had said that sometime about something, and it means “we will fight for ever and ever.”But they didn’t! At the very first volley the berries stained their dainty frocks, and the girls fled, screaming angrily:“You horrid things! You’ve ruined our frocks!”And the boys grinning delightedly, and rolling their black eyes, thumped their little brown heels on the ground, and beat their little bare, brown knees and chanted all together:“Akarana Mototapu Rangitoto Ra!”And of course you all know what that means! You don’t? Well, I’m not quite sure myself, because I couldn’t find it in the dictionary (so careless of Mr. Webster!) but it really doesn’t matter.","['course', 'fashion', 'change', 'need', 'surprised', 'find', 'crimson', 'kilt', 'soon', 'piccaninny', 'girl', 'walk', 'pretty', 'little', 'white', 'frilly', 'petticoat', 'make', 'clematis', 'blossom', 'flower', 'rather', 'silly', 'piccaninny', 'live', 'deep', 'bush', 'hurt', 'fashion', 'absurd', 'look', 'lady', 'wear', 'coat', 'climate', 'make', 'change', 'kind', 'fashion', 'change', 'except', 'sometimes', 'take', 'great', 'pain', 'iron', 'crease', 'time', 'iron', 'carefull-ee', 'reason', 'like', 'girl', 'change', 'frock', 'course', 'girl', 'would', 'never', 'play', 'girl', 'would', 'scar', 'play', 'berry', 'fight', 'like', 'girl', 'brave', 'could', 'would', 'answer', 'collect', 'puriri', 'berry', 'purply', 'rather', 'squashy', 'yell', 'chorus', 'mate', 'mate', 'tenei', 'tangata', 'puhuru', 'huruna', 'tiki', 'whaka', 'whiti', 'upane', 'upane', 'upane', 'kaupani', 'whiti', 'mean', 'something', 'warlike', 'girl', 'answer', 'shrilly', 'whawhai', 'tonu', 'heard', 'someone', 'sometime', 'something', 'mean', 'fight', 'ever', 'ever', 'first', 'volley', 'berry', 'stain', 'dainty', 'frock', 'girl', 'flee', 'scream', 'angrily', 'horrid', 'thing', 'ruin', 'frock', 'grin', 'delightedly', 'roll', 'black', 'thumped', 'little', 'brown', 'heel', 'ground', 'beat', 'little', 'bare', 'brown', 'knee', 'chant', 'together', 'akarana', 'mototapu', 'rangitoto', 'course', 'know', 'mean', 'well', 'quite', 'sure', 'find', 'dictionary', 'careless', 'webster', 'really', 'matter']","['course', 'fashion', 'change', 'need', 'surprised_find', 'crimson', 'kilt', 'soon', 'piccaninny', 'girl', 'walk', 'pretty', 'little', 'white', 'frilly', 'petticoat', 'make', 'clematis', 'blossom', 'flower', 'rather', 'silly', 'piccaninny', 'live', 'deep', 'bush', 'hurt', 'fashion', 'absurd', 'look', 'lady', 'wear', 'coat', 'climate', 'make', 'change', 'kind', 'fashion', 'change', 'except', 'sometimes', 'take', 'great', 'pain', 'iron', 'crease', 'time', 'iron', 'carefull-ee', 'reason', 'like', 'girl', 'change', 'frock', 'course', 'girl', 'would', 'never', 'play', 'girl', 'would', 'scar', 'play', 'berry', 'fight', 'like', 'girl', 'brave', 'could', 'would', 'answer', 'collect', 'puriri', 'berry', 'purply', 'rather', 'squashy', 'yell', 'chorus', 'mate', 'mate', 'tenei', 'tangata', 'puhuru', 'huruna', 'tiki', 'whaka', 'whiti', 'upane', 'upane', 'upane', 'kaupani', 'whiti', 'mean', 'something', 'warlike', 'girl', 'answer', 'shrilly', 'whawhai', 'tonu', 'heard', 'someone', 'sometime', 'something', 'mean', 'fight', 'ever', 'ever', 'first', 'volley', 'berry', 'stain', 'dainty', 'frock', 'girl', 'flee', 'scream', 'angrily', 'horrid', 'thing', 'ruin', 'frock', 'grin', 'delightedly', 'roll', 'black', 'thumped', 'little', 'brown', 'heel', 'ground', 'beat', 'little', 'bare', 'brown', 'knee', 'chant', 'together', 'akarana', 'mototapu', 'rangitoto', 'course', 'know', 'mean', 'well', 'quite_sure', 'find', 'dictionary', 'careless', 'webster', 'really', 'matter']",austronesian,sid795
981,new_zealand_native,The Great Red Enemy,"One day one of those tiresome picnic parties came again to the bush, and after a great deal of stupid and rather terrifying noise, during which every Piccaninny and Bush Baby and all the other bush folk lay hidden away in utter silence, the people all went away again, and the Wee Folk were free to come out of their hiding places and turn over curiously the few things the party had left.There was an empty meat tin which flashed so brightly that the Piccaninnies took it for a helmet, and each in turn tried to wear it; but it was so big that it simply hid them altogether, so very regretfully they had to throw it away. Then there were a few crusts of bread which quite by accident one of the boys discovered to be good to eat. They finished every crumb of the bread and enjoyed it, but on the whole agreed that fern root tasted nicer. There was an empty bottle that nobody dared go near, for they thought it was some kind of gun, and a baby’s woollen bootee, which the Piccaninnies found most useful as an enormous bag to be filled with berries. But most mysterious, and therefore most interesting, though a little frightening, was a large heap of grey smoking ashes where the picnic fire had been.The Piccaninnies circled round and round this queer grey pile wondering what on earth it could be. One boy venturing a little nearer than the others trod on a live cinder, for the fire was not as dead as it ought to have been, and jumped back howling and hopping round and round on one foot, holding the other.When they crowded round him asking what had happened he cried in fear:“The Red Enemy bit me. He lives under that grey mound, and I saw his red eye flash as I went near. That is his breath you see rising up through the trees.”The Piccaninnies looked frightened and backed away from the grey mound, but all the rest of that evening they came again and again to stare upon the Red Enemy, and each time they came his red eyes seemed to flash p brighter, his thick white breath to grow denser as it wound up through the trees, and he seemed to be purring and growling to himself.When the Piccaninnies went to bed that night they were very uneasy and could not sleep well. The sound of the Red Enemy’s breathing seemed to fill the bush with a low roaring, and his breath stole in and out of the trees like a reddish mist; the air was very hot and dry. One of the Piccaninnies, a brave little fellow, said that he would go and see what their strange new enemy was doing, and sliding down his sleeping-tree he set off.He had not gone far before the heat and the stifling air drove him hack, and rushing back to his friends he cried:“Run for your lives! Quick! Quick! The Great Red Enemy is coming. He is roaring with anger and tearing the trees down as he comes. None of us can hope to escape him, for he has a million bright red eyes which he sends flying through the bush in all directions to find us, and his breath is so thick that we will be lost in it if we don’t run now. Run! Run!”The Piccaninnies did not wait to be told twice. Without waiting to pack up they slid down the trees and started to run through the dark bush, and soon there were hundreds of little bush creatures all joining in the race for life.On, on they ran in fear and excitement, hearing the angry roaring of the Great Red Enemy behind them, feeling his hot breath scorching them as it writhed and twisted through the trees in reddish-black billows. Some of his millions of angry, red searching eyes flew or drifted past them, but they never stopped for a moment. And now they had left the trees behind them and were running over clear ground, and before long they reached the edge of the swamp, lying dark and cool before them.In their haste and fear they all plunged in headlong and found the water so fresh and cool and delightful after their heat and hurry, that they burrowed deeper into it, only leaving their little black heads sticking out.All that night they lay and watched the Great Red Enemy in his wrath worrying and tearing their poor trees to pieces, and all next day and the next it lasted, and then nothing was left of their beautiful bush but a few black, ugly stumps and a great grey waste of ashes.And from the ashes rose the smoking dense breath of the Red Enemy, and every now and then he flashed an angry red eye. The Piccaninnies who had lived in that part of the bush could never again return to the cool green shades of the forest, never slide down a fern leaf, or swing on the branches, or pick puriri berries, or pelt the morepork in the daytime.What could they do? Where could they go? Poor, poor little Piccaninnies!Well, this is what they did. Having no home to go to, and finding the water very delightful they decided to make their home in it. At first they would only stay timidly near the edges where the water was not deep, but by-and-by through living entirely in the water they grew webbed-toes (you try it!) and became as much at home in the swamp as any other water-creature. Some of them even grew elegant little tails (believe me or not, as you choose!) and they became known in the swamp as the Teenywiggles, and some day you may hear something more of the doings of the Teenywiggles.","['tiresome', 'picnic', 'party', 'come', 'bush', 'great', 'deal', 'stupid', 'rather', 'terrify', 'noise', 'every', 'piccaninny', 'bush', 'baby', 'bush', 'folk', 'hidden', 'away', 'utter', 'silence', 'people', 'away', 'folk', 'free', 'come', 'hiding', 'place', 'turn', 'curiously', 'thing', 'party', 'left', 'empty', 'meat', 'flash', 'brightly', 'piccaninny', 'take', 'helmet', 'turn', 'wear', 'simply', 'altogether', 'regretfully', 'throw', 'away', 'crust', 'bread', 'quite', 'accident', 'discover', 'good', 'finish', 'every', 'crumb', 'bread', 'enjoy', 'whole', 'agree', 'fern', 'root', 'taste', 'nicer', 'empty', 'bottle', 'nobody', 'dare', 'near', 'thought', 'kind', 'baby', 'woollen', 'bootee', 'piccaninny', 'found', 'useful', 'enormous', 'fill', 'berry', 'mysterious', 'therefore', 'interest', 'though', 'little', 'frighten', 'large', 'heap', 'grey', 'smoking', 'picnic', 'fire', 'piccaninny', 'circle', 'round', 'round', 'queer', 'grey', 'pile', 'wonder', 'earth', 'could', 'venture', 'little', 'nearer', 'others', 'trod', 'live', 'cinder', 'fire', 'dead', 'ought', 'jumped', 'back', 'howl', 'round', 'round', 'foot', 'hold', 'crowd', 'round', 'happen', 'fear', 'enemy', 'life', 'grey', 'mound', 'flash', 'near', 'breath', 'rise', 'tree', 'piccaninny', 'look', 'frighten', 'back', 'away', 'grey', 'mound', 'rest', 'even', 'come', 'stare', 'upon', 'enemy', 'time', 'come', 'seem', 'flash', 'brighter', 'thick', 'white', 'breath', 'grow', 'denser', 'wound', 'tree', 'seem', 'purr', 'growl', 'piccaninny', 'night', 'uneasy', 'could', 'sleep', 'well', 'sound', 'enemy', 'breathing', 'seem', 'fill', 'bush', 'roar', 'breath', 'stole', 'tree', 'like', 'reddish', 'mist', 'piccaninny', 'brave', 'little', 'fellow', 'would', 'strange', 'enemy', 'slide', 'sleeping-tree', 'heat', 'stifle', 'drove', 'hack', 'rush', 'back', 'friend', 'life', 'quick', 'quick', 'great', 'enemy', 'come', 'roar', 'anger', 'tear', 'tree', 'come', 'none', 'hope', 'escape', 'million', 'bright', 'sends', 'bush', 'direction', 'find', 'breath', 'thick', 'lose', 'piccaninny', 'wait', 'told', 'twice', 'without', 'wait', 'pack', 'slid', 'tree', 'start', 'dark', 'bush', 'soon', 'hundred', 'little', 'bush', 'creature', 'join', 'race', 'life', 'fear', 'excitement', 'hearing', 'angry', 'roar', 'great', 'enemy', 'behind', 'feel', 'breath', 'scorch', 'writhe', 'twist', 'tree', 'reddish-black', 'billow', 'million', 'angry', 'search', 'flew', 'drift', 'past', 'never', 'stop', 'moment', 'left', 'tree', 'behind', 'clear', 'ground', 'long', 'reach', 'edge', 'swamp', 'dark', 'cool', 'haste', 'fear', 'plunge', 'headlong', 'found', 'water', 'fresh', 'cool', 'delightful', 'heat', 'hurry', 'burrow', 'deeper', 'leave', 'little', 'black', 'head', 'stick', 'night', 'watch', 'great', 'enemy', 'wrath', 'worry', 'tear', 'poor', 'tree', 'piece', 'next', 'next', 'last', 'nothing', 'left', 'beautiful', 'bush', 'black', 'ugly', 'stump', 'great', 'grey', 'waste', 'rise', 'smoking', 'dense', 'breath', 'enemy', 'every', 'flash', 'angry', 'piccaninny', 'live', 'part', 'bush', 'could', 'never', 'return', 'cool', 'green', 'shade', 'forest', 'never', 'slide', 'fern', 'leaf', 'swing', 'branch', 'pick', 'puriri', 'berry', 'pelt', 'morepork', 'daytime', 'could', 'could', 'poor', 'poor', 'little', 'piccaninny', 'well', 'home', 'find', 'water', 'delightful', 'decide', 'make', 'home', 'first', 'would', 'stay', 'timidly', 'near', 'edge', 'water', 'deep', 'by-and-by', 'living', 'entirely', 'water', 'grow', 'webbed-toes', 'become', 'much', 'home', 'swamp', 'water-creature', 'even', 'grow', 'elegant', 'little', 'tail', 'believe', 'choose', 'become', 'know', 'swamp', 'teenywiggles', 'hear', 'something', 'doings', 'teenywiggles']","['tiresome', 'picnic', 'party', 'come', 'bush', 'great_deal', 'stupid', 'rather', 'terrify', 'noise', 'every', 'piccaninny', 'bush', 'baby', 'bush', 'folk', 'hidden', 'away', 'utter', 'silence', 'people', 'away', 'folk', 'free', 'come', 'hiding_place', 'turn', 'curiously', 'thing', 'party', 'left', 'empty', 'meat', 'flash', 'brightly', 'piccaninny', 'take', 'helmet', 'turn', 'wear', 'simply', 'altogether', 'regretfully', 'throw', 'away', 'crust_bread', 'quite', 'accident', 'discover', 'good', 'finish', 'every', 'crumb_bread', 'enjoy', 'whole', 'agree', 'fern', 'root', 'taste', 'nicer', 'empty', 'bottle', 'nobody', 'dare', 'near', 'thought', 'kind', 'baby', 'woollen', 'bootee', 'piccaninny', 'found', 'useful', 'enormous', 'fill', 'berry', 'mysterious', 'therefore', 'interest', 'though', 'little', 'frighten', 'large', 'heap', 'grey', 'smoking', 'picnic', 'fire', 'piccaninny', 'circle_round', 'round', 'queer', 'grey', 'pile', 'wonder', 'earth', 'could', 'venture', 'little', 'nearer', 'others', 'trod', 'live', 'cinder', 'fire', 'dead', 'ought', 'jumped', 'back', 'howl', 'round_round', 'foot', 'hold', 'crowd_round', 'happen', 'fear', 'enemy', 'life', 'grey', 'mound', 'flash', 'near', 'breath', 'rise', 'tree', 'piccaninny', 'look', 'frighten', 'back', 'away', 'grey', 'mound', 'rest', 'even', 'come', 'stare', 'upon', 'enemy', 'time', 'come', 'seem', 'flash', 'brighter', 'thick', 'white', 'breath', 'grow', 'denser', 'wound', 'tree', 'seem', 'purr', 'growl', 'piccaninny', 'night', 'uneasy', 'could', 'sleep', 'well', 'sound', 'enemy', 'breathing', 'seem', 'fill', 'bush', 'roar', 'breath', 'stole', 'tree', 'like', 'reddish', 'mist', 'piccaninny', 'brave', 'little', 'fellow', 'would', 'strange', 'enemy', 'slide', 'sleeping-tree', 'heat', 'stifle', 'drove', 'hack', 'rush', 'back', 'friend', 'life', 'quick_quick', 'great', 'enemy', 'come', 'roar', 'anger', 'tear', 'tree', 'come', 'none', 'hope', 'escape', 'million', 'bright', 'sends', 'bush', 'direction', 'find', 'breath', 'thick', 'lose', 'piccaninny', 'wait', 'told', 'twice', 'without', 'wait', 'pack', 'slid', 'tree', 'start', 'dark', 'bush', 'soon', 'hundred', 'little', 'bush', 'creature', 'join', 'race', 'life', 'fear', 'excitement', 'hearing', 'angry', 'roar', 'great', 'enemy', 'behind', 'feel', 'breath', 'scorch', 'writhe', 'twist', 'tree', 'reddish-black', 'billow', 'million', 'angry', 'search', 'flew', 'drift', 'past', 'never', 'stop', 'moment', 'left', 'tree', 'behind', 'clear', 'ground', 'long', 'reach', 'edge', 'swamp', 'dark', 'cool', 'haste', 'fear', 'plunge', 'headlong', 'found', 'water', 'fresh', 'cool', 'delightful', 'heat', 'hurry', 'burrow', 'deeper', 'leave', 'little', 'black', 'head', 'stick', 'night', 'watch', 'great', 'enemy', 'wrath', 'worry', 'tear', 'poor', 'tree', 'piece', 'next', 'next', 'last', 'nothing', 'left', 'beautiful', 'bush', 'black', 'ugly', 'stump', 'great', 'grey', 'waste', 'rise', 'smoking', 'dense', 'breath', 'enemy', 'every', 'flash', 'angry', 'piccaninny', 'live', 'part', 'bush', 'could', 'never', 'return', 'cool', 'green', 'shade', 'forest', 'never', 'slide', 'fern', 'leaf', 'swing', 'branch', 'pick', 'puriri', 'berry', 'pelt', 'morepork', 'daytime', 'could', 'could', 'poor', 'poor', 'little', 'piccaninny', 'well', 'home', 'find', 'water', 'delightful', 'decide', 'make', 'home', 'first', 'would', 'stay', 'timidly', 'near', 'edge', 'water', 'deep', 'by-and-by', 'living', 'entirely', 'water', 'grow', 'webbed-toes', 'become', 'much', 'home', 'swamp', 'water-creature', 'even', 'grow', 'elegant', 'little', 'tail', 'believe', 'choose', 'become', 'know', 'swamp', 'teenywiggles', 'hear', 'something', 'doings', 'teenywiggles']",austronesian,sid981
